,0112/2///61987#ABA104,1,2,2015/7/23,2015/7/23,2017/3/8,reference to Project information,,,,,,,,,,reference to block ABA398,,,,,,,,NON_DEPENDENT_P_DET,0112/2///61987#ABA000,CLASS_REFERENCE_TYPE(0112/2///61987#ABA398),,,,,,,,,,,,,,,,,,,,,,,,,,,,,,,,Standard,IEC 61987,,2017/3/8,,SC65E ? IEC 61987,C00018
,0112/2///61987#ABA105,1,2,2015/7/23,2015/7/23,2017/3/8,contact name,,,,,,,,,,surname of a contact person,,,,,,,,NON_DEPENDENT_P_DET,0112/2///61987#ABA000,STRING_TYPE,,,,,,,,,,,,,,,,,,,,,,,,,,,,,,,,Standard,IEC 61987,,2017/3/8,,SC65E ? IEC 61987,C00018
,0112/2///61987#ABA106,2,5,2013/8/27,2013/10/16,2017/3/20,minimum limit of storage relative humidity,,,,,,,,,,lowest relative humidity to which a device may be subject between the time of construction and the time of operation without permanent impairment of operating characteristics,,,,,,,,NON_DEPENDENT_P_DET,0112/2///61987#ABA000,REAL_MEASURE_TYPE,%,,,,,,,,,,,0112/2///62720#UAA000,,,,,,,,,,,,,,,,,,,0112/2///61987#ABT533,Standard,,,2017/3/20,,SC65E ? IEC 61987,C0004
,0112/2///61987#ABA107,2,6,2013/8/27,2013/10/16,2017/3/20,maximum limit of storage relative humidity,,,,,,,,,,highest relative humidity to which a device may be subject between the time of construction and the time of operation without permanent impairment of operating characteristics,,,,,,,,NON_DEPENDENT_P_DET,0112/2///61987#ABA000,REAL_MEASURE_TYPE,%,,,,,,,,,,,0112/2///62720#UAA000,,,,,,,,,,,,,,,,,,,0112/2///61987#ABT533,Standard,,,2017/3/20,,SC65E ? IEC 61987,C0004
,0112/2///61987#ABA108,2,4,2013/8/27,2013/10/16,2017/3/20,reference standard for vibration resistance,,,,,,,,,,standard to which a statement on vibration resistance refers,,,,,,,,NON_DEPENDENT_P_DET,0112/2///61987#ABA000,STRING_TYPE,,,,,,,,,,,,,,,,,,,,,,,,,,,,,,,,Standard,,,2017/3/20,,SC65E ? IEC 61987,C0004
,0112/2///61987#ABA109,2,4,2013/8/27,2013/10/16,2017/3/20,reference standard for mechanical shock resistance,,,,,,,,,,standard to which a statement on mechanical shock resistance refers,,,,,,,,NON_DEPENDENT_P_DET,0112/2///61987#ABA000,STRING_TYPE,,,,,,,,,,,,,,,,,,,,,,,,,,,,,,,,Standard,,,2017/3/20,,SC65E ? IEC 61987,C0004
,0112/2///61987#ABA110,2,7,2013/8/27,2013/10/16,2017/3/20,maximum dynamic viscosity,,,,,,,,,,highest dynamic viscosity for which a device is or should be designed to operate within its specified limits,,,,,,,,NON_DEPENDENT_P_DET,0112/2///61987#ABA000,REAL_MEASURE_TYPE,mPa?s,,,,,,,,,,,0112/2///62720#UAA797,,,,,,,,,,,,,,,,,,,0112/2///61987#ABT571,Standard,,,2017/3/20,,SC65E ? IEC 61987,C00018
,0112/2///61987#ABA111,2,6,2013/8/27,2013/10/16,2017/3/20,maximum kinematic viscosity,,,,,,,,,,highest kinematic viscosity for which a device is or should be designed to operate within its specified limits,,,,,,,,NON_DEPENDENT_P_DET,0112/2///61987#ABA000,REAL_MEASURE_TYPE,mm?/s,,,,,,,,,,,0112/2///62720#UAA872,,,,,,,,,,,,,,,,,,,0112/2///61987#ABT553,Standard,,,2017/3/20,,SC65E ? IEC 61987,C0004
,0112/2///61987#ABA112,2,8,2013/9/27,2013/10/16,2017/3/20,minimum fluid velocity,,,,,,,,,,lowest fluid velocity for which a device is or should be designed to operate within its specified limits,,,,,,,,NON_DEPENDENT_P_DET,0112/2///61987#ABA000,REAL_MEASURE_TYPE,m/s,,,,,,,,,,,0112/2///62720#UAA733,,,,,,,,,,,,,,,,,,,0112/2///61987#ABT509,Standard,,,2017/3/20,,SC65E ? IEC 61987,C0004
,0112/2///61987#ABA113,1,2,2015/7/23,2015/7/23,2017/3/8,document revision,,,,,,,,,,alphanumeric character sequence uniquely identifying a document revision,,,,,,,,NON_DEPENDENT_P_DET,0112/2///61987#ABA000,STRING_TYPE,,,,,,,,,,,,,,,,,,,,,,,,,,,,,,,,Standard,IEC 61987,,2017/3/8,,SC65E ? IEC 61987,C00018
,0112/2///61987#ABA114,2,8,2013/9/27,2013/10/16,2017/3/20,maximum fluid velocity,,,,,,,,,,highest fluid velocity for which a device is or should be designed to operate within its specified limits,,,,,,,,NON_DEPENDENT_P_DET,0112/2///61987#ABA000,REAL_MEASURE_TYPE,m/s,,,,,,,,,,,0112/2///62720#UAA733,,,,,,,,,,,,,,,,,,,0112/2///61987#ABT509,Standard,,,2017/3/20,,SC65E ? IEC 61987,C0004
,0112/2///61987#ABA115,2,7,2013/8/27,2013/10/16,2017/3/20,pressure drop at upper range-limit of flow rate,,,,,,,,,,maximum permanent loss of pressure over the primary element at upper range-limit of flow rate for which the device has or should be designed,,,,,,,,NON_DEPENDENT_P_DET,0112/2///61987#ABA000,REAL_MEASURE_TYPE,bar,,,,,,,,,,,0112/2///62720#UAA323,,,,,,,,,,,,,,,,,,,0112/2///61987#ABT524,Standard,,,2017/3/20,,SC65E ? IEC 61987,C00004
,0112/2///61987#ABA116,2,6,2013/8/27,2013/10/16,2017/3/20,dynamic viscosity for pressure drop statement,,,,,,,,,,dynamic viscosity on the basis of which a pressure drop statement is valid,,,,,,,,NON_DEPENDENT_P_DET,0112/2///61987#ABA000,REAL_MEASURE_TYPE,mPa?s,,,,,,,,,,,0112/2///62720#UAA797,,,,,,,,,,,,,,,,,,,0112/2///61987#ABT571,Standard,,,2017/3/20,,SC65E ? IEC 61987,C00018
,0112/2///61987#ABA117,2,4,2013/8/27,2013/10/16,2017/3/20,reference standard for thermal shock resistance,,,,,,,,,,standard to which a statement on thermal shock resistance refers,,,,,,,,NON_DEPENDENT_P_DET,0112/2///61987#ABA000,STRING_TYPE,,,,,,,,,,,,,,,,,,,,,,,,,,,,,,,,Standard,,,2017/3/20,,SC65E ? IEC 61987,C0004
,0112/2///61987#ABA118,2,4,2013/8/27,2013/10/16,2017/3/20,reference standard for pressure shock resistance,,,,,,,,,,standard to which a statement on pressure shock resistance refers,,,,,,,,NON_DEPENDENT_P_DET,0112/2///61987#ABA000,STRING_TYPE,,,,,,,,,,,,,,,,,,,,,,,,,,,,,,,,Standard,,,2017/3/20,,SC65E ? IEC 61987,C0004
,0112/2///61987#ABA119,2,5,2013/9/27,2013/10/16,2017/3/20,lower limiting value of flow velocity,,,,,,,,,,lowest fluid velocity to which the wetted parts of the measuring equipment may be subjected without permanent impairment of operating characteristics,,,,,,,,NON_DEPENDENT_P_DET,0112/2///61987#ABA000,REAL_MEASURE_TYPE,m/s,,,,,,,,,,,0112/2///62720#UAA733,,,,,,,,,,,,,,,,,,,0112/2///61987#ABT509,Standard,,,2017/3/20,,SC65E ? IEC 61987,C0004
,0112/2///61987#ABA120,2,6,2013/9/27,2013/10/16,2017/3/20,upper limiting value of flow velocity,,,,,,,,,,highest fluid velocity to which the wetted parts of the equipment can be subjected without permanent impairment of operating characteristics,,,,,,,,NON_DEPENDENT_P_DET,0112/2///61987#ABA000,REAL_MEASURE_TYPE,m/s,,,,,,,,,,,0112/2///62720#UAA733,,,,,,,,,,,,,,,,,,,0112/2///61987#ABT509,Standard,,,2017/3/20,,SC65E ? IEC 61987,C00019
,0112/2///61987#ABA121,1,2,2015/7/23,2015/7/23,2017/3/8,document description,,,,,,,,,,plain text characterizing the content of the document,,,,,,,,NON_DEPENDENT_P_DET,0112/2///61987#ABA000,STRING_TYPE,,,,,,,,,,,,,,,,,,,,,,,,,,,,,,,,Standard,IEC 61987,,2017/3/8,,SC65E ? IEC 61987,C00018
,0112/2///61987#ABA122,2,5,2013/8/27,2013/10/16,2017/3/20,upper limiting value of mass flow,,,,,,,,,,highest mass flow rate to which the measuring equipment may be subjected during operation without permanent impairment of operating characteristics,,,,,,,,NON_DEPENDENT_P_DET,0112/2///61987#ABA000,REAL_MEASURE_TYPE,kg/h,,,,,,,,,,,0112/2///62720#UAA607,,,,,,,,,,,,,,,,,,,0112/2///61987#ABT545,Standard,,,2017/3/20,,SC65E ? IEC 61987,C0004
